{
  "header": {
    "schema": "mission_control",
    "schema_version": "0.1.0",
    "msg_id": "7f3c2a10-5b6e-4c1d-9a16-0c1d2e3f4a5b",
    "uav_id": "uav-01",
    "mission_id": "M-20261002-001",
    "stamp_utc": "2026-10-02T03:15:00.000Z",
    "producer": "backend/mission_manager@0.1.0"
  },
  "command": "CANCEL_RTL",
  "issued_by": "kiemlam.truc01",
  "reason": "Tổ tuần tra đã xác nhận tại chỗ"
}
